BENV00001,Be Smarter Save Water Cotton T-Shirt,400,1799,1099,Shop Be Smarter Save Water Cotton  Online T-Shirt | Bargain.pk,be-smarter-save-water-t-shirt,Be Smarter Save Water,environment,187
BENV00002,Rethink 100% Pure Cotton T-Shirt,400,1799,1099,Shop Rethink 100% Pure Cotton T-Shirt Online | Bargain.pk,rethink-t-shirt,Rethink,environment,187
BENV00003,Go Green Save Our Planet Printed T-Shirt,400,1799,1099,Shop Go Green Save Our Planet Printed T-Shirt | Bargain.pk,go-green-save-our-planet-t-shirt,Go Green Save Our Planet,environment,187
BENV00004,Don’t Waste Water Cotton T-Shirt,400,1799,1099,Shop Don’t Waste Water Cotton T-Shirt Online | Bargain.pk,don’t-waste-water-t-shirt,Don’t Waste Water,environment,187
BENV00005,Go Green Save Earth Cotton Printed T-Shirt,550,1999,1299,Shop Go Green Save Earth Cotton Printed T-Shirt | Bargain.pk,go-green-save-earth-t-shirt,Go Green Save Earth,environment,187
BENV00006,Save Tree 100% Cotton T-Shirt,400,1799,1099,Shop Save Tree 100% Cotton T-Shirt Online | Bargain.pk,save-tree-t-shirt,Save Tree,environment,187
BENV00007,Love Our Planet Printed T-Shirt,400,1799,1099,Shop Love Our Planet Printed T-Shirt Online | Bargain.pk,love-our-planet-t-shirt,Love Our Planet,environment,187
BENV00008,Keep Calm Save The Environment Cotton T-Shirt,400,1799,1099,Shop Keep Calm Save The Environment Cotton T-Shirt | Bargain.pk,keep-calm-save-the-environment-t-shirt,Keep Calm Save The Environment,environment,187
BENV00009,Reuse Reduce Recycle Cotton Printed T-Shirt,400,1799,1099,Shop Reuse Reduce Recycle Cotton Printed T-Shirt | Bargain.pk,reuse-reduce-recycle-t-shirt,Reuse Reduce Recycle,environment,187
BENV000010,Make Pakistan Green Again Printed T-Shirt,400,1799,1099,Shop Make Pakistan Green Again Printed T-Shirt | Bargain.pk,make-pakistan-green-again-t-shirt,Make Pakistan Green Again,environment,187
