BRUN00001,No speed limit Run - Cotton T-shirt ,400,1799,1099,No speed limit Run - Cotton T-shirt ,Shop No Speed Limit Run 100% Cotton T-shirt | Bargain.pk,no-speed-limit-run-t-shirt,No speed limit
BRUN00002,Born to run - Printed T-shirt,400,1799,1099,Born to run - Printed T-shirt,Shop Born to Run Round Neck Printed T-shirt Online | Bargain.pk,born-to-run-t-shirt,Born to run
BRUN00003,ID Rather be Running - Round Neck T-shirt,400,1799,1099,ID Rather be Running - Round Neck T-shirt,Shop ID Rather be Running Round Neck T-shirt | Bargain.pk,id-rather-be-running-t-shirt,ID rather be running
BRUN00004,Just run - Cotton T-shirt,400,1799,1099,Just run - Cotton T-shirt,Shop Just Run 100% Cotton T-shirt Online| Bargain.pk,just-run-t-shirt,Just run
BRUN00005,I Do Marathon Run - 100% Cotton T-shirt,400,1799,1099,I Do Marathon Run - 100% Cotton T-shirt,Shop I Do Marathon Run 100% Cotton T-shirt | Bargain.pk,i-do-marathon-run-t-shirt,I do marathon on netflix
BRUN00006,No excuses Run on Time - Cotton T-shirt,400,1799,1099,No excuses Run on Time - Cotton T-shirt,Shop No Excuses Run on Time Cotton T-shirt | Bargain.pk,no-excuses-run-on-time-t-shirt,No excuses
BRUN00007,Sloth Running - Round Neck T-shirt,400,1799,1099,Sloth Running - Round Neck T-shirt,Shop Sloth Running Round Neck Cotton T-shirt | Bargain.pk,sloth-running-t-shirt,Sloth running team lets nap instead
