BFUN000010,There No We In Pizza Printed T-Shirt,550,1999,1299,Shop There No We In Pizza Printed T-Shirt | Bargain.pk,there-no-we-in-pizza-printed-t-shirt,There No We In Pizza,funny,237
BFUN000011,Why Not Printed T-Shirt,400,1799,1099,Shop Why Not Printed T-Shirt | Bargain.pk,why-not-printed-t-shirt,Why Not,funny,237
BFUN000012,Last Clean Shirt Printed T-Shirt,400,1799,1099,Shop Last Clean Shirt Printed T-Shirt | Bargain.pk,last-clean-shirt-printed-t-shirt,Last Clean Shirt,funny,237
BFUN000013,You Were Born Original Printed T-Shirt,550,1999,1299,Shop You Were Born Original Printed T-Shirt | Bargain.pk,you-were-born-original-printed-t-shirt,You Were Born Original Dont Die A Copy,funny,237
BFUN000014,Dont Grow Up Its A Trap  Printed T-Shirt,400,1799,1099,Shop Dont Grow Up Its A Trap  Printed T-Shirt | Bargain.pk,dont-grow-up-its-a-trap-printed-t-shirt,Dont Grow Up Its A Trap,funny,237
BFUN000015,Last Name Hungry First Printed T-Shirt,400,1799,1099,Shop Last Name Hungry First Printed T-Shirt | Bargain.pk,last-name-hungry-first-printed-t-shirt,Last Name Hungry First Name Always,funny,237
BFUN000016,I Love U More Than Free Wifi Printed T-Shirt,400,1799,1099,Shop I Love U More Than Free Wifi Printed T-Shirt | Bargain.pk,i-love-u-more-than-free-wifi-printed-t-shirt,I Love U More Than Free Wifi,funny,237
BFUN000017,I Hate Being Sexy But  Printed T-Shirt,400,1799,1099,Shop I Hate Being Sexy But  Printed T-Shirt | Bargain.pk,i-hate-being-sexy-but-printed-t-shirt,I Hate Being Sexy But Someone Has To Do It,funny,237
BFUN000018,Money Talks Mine Just  Printed T-Shirt,550,1999,1299,Shop Money Talks Mine Just  Printed T-Shirt | Bargain.pk,money-talks-mine-just--printed-t-shirt,Money Talks Mine Just Says Goodbye,funny,237
BFUN000019,Be Bold Or Italic Never Regular Printed T-Shirt,400,1799,1099,Shop Be Bold Or Italic Never Regular Printed T-Shirt | Bargain.pk,be-bold-or-italic-never-regular-printed-t-shirt,Be Bold Or Italic Never Regular,funny,237
BFUN000020,Fat People Are Harder To Kidnap Printed T-Shirt,400,1799,1099,Shop Fat People Are Harder To Kidnap Printed T-Shirt | Bargain.pk,fat-people-are-harder-to-kidnap-printed-t-shirt,Fat People Are Harder To Kidnap,funny,237
BFUN000021,Six Pack Cooming Soon Printed T-Shirt,400,1799,1099,Shop Six Pack Cooming Soon Printed T-Shirt | Bargain.pk,six-pack-cooming-soon-printed-t-shirt,Six Pack Cooming Soon,funny,237
BFUN000022,Math Mental Abuse To Humans Printed T-Shirt,400,1799,1099,Shop Math Mental Abuse To Humans Printed T-Shirt | Bargain.pk,math-mental-abuse-to-humans-printed-t-shirt,Math Mental Abuse To Humans,funny,237
BFUN000023,With A Body Like This Printed T-Shirt,550,1999,1299,Shop With A Body Like This Printed T-Shirt | Bargain.pk,with-a-body-like-this-printed-t-shirt,With A Body Like This Who Needs Hair,funny,237
BFUN000024,Is It Friday Yet Printed T-Shirt,400,1799,1099,Shop Is It Friday Yet Printed T-Shirt | Bargain.pk,is-it-friday-yet-printed-t-shirt,Is It Friday Yet,funny,237
BFUN000025,Look 18 Act 12 Fel 10 Printed T-Shirt,400,1799,1099,Shop Look 18 Act 12 Fel 10 Printed T-Shirt | Bargain.pk,look-18-act-12-fel-10-printed-t-shirt,Look 18 Act 12 Fel 10 That Makes Me 40,funny,237
BFUN000026,Sorry Im Not Listening Printed T-Shirt,400,1799,1099,Shop Sorry Im Not Listening Printed T-Shirt | Bargain.pk,sorry-im-not-listening-printed-t-shirt,Sorry Im Not Listening,funny,237
BFUN000027,My Blood Type Is Coffee Printed T-Shirt,400,1799,1099,Shop My Blood Type Is Coffee Printed T-Shirt | Bargain.pk,my-blood-type-is-coffee-printed-t-shirt,My Blood Type Is Coffee,funny,237
BFUN000028,I Might Start Talking About Printed T-Shirt,550,1999,1299,Shop I Might Start Talking About Printed T-Shirt | Bargain.pk,i-might-start-talking-about-printed-t-shirt,I Might Start Talking About My Grand Kids At Any Time,funny,237
BFUN000029,Awesome Printed T-Shirt,400,1799,1099,Shop Awesome Printed T-Shirt | Bargain.pk,awesome-printed-t-shirt,Awesome,funny,237
BFUN000030,Im Not Balding Printed T-Shirt,400,1799,1099,Shop Im Not Balding Printed T-Shirt | Bargain.pk,im-not-balding-printed-t-shirt,Im Not Balding Im Building A Solar Panel,funny,237
BFUN000031,I Dont Care Printed T-Shirt,400,1799,1099,Shop I Dont Care Printed T-Shirt | Bargain.pk,i-dont-care-printed-t-shirt,I Dont Care,funny,237
BFUN000032,Libra Never Underestimate Printed T-Shirt,400,1799,1099,Shop Libra Never Underestimate Printed T-Shirt | Bargain.pk,libra-never-underestimate-printed-t-shirt,Libra Never Underestimate,funny,237
BFUN000033,Despresso When You Run  Printed T-Shirt,400,1799,1099,Shop Despresso When You Run  Printed T-Shirt | Bargain.pk,despresso-when-you-run--printed-t-shirt,Despresso When You Run Out Of Coffee,funny,237
BFUN000034,This Is What An Awesome Printed T-Shirt,400,1799,1099,Shop This Is What An Awesome Printed T-Shirt | Bargain.pk,this-is-what-an-awesome-printed-t-shirt,This Is What An Awesome Husband Look Like,funny,237
BFUN000035,Some People Need A High Five Printed T-Shirt,550,1999,1299,Shop Some People Need A High Five Printed T-Shirt | Bargain.pk,some-people-need-a-high-five-printed-t-shirt,Some People Need A High Five In The Face With A Chair,funny,237
BFUN000036,Not Everyone Looks Printed T-Shirt,400,1799,1099,Shop Not Everyone Looks Printed T-Shirt | Bargain.pk,not-everyone-looks-printed-t-shirt,Not Everyone Looks This Good At 40,funny,237
BFUN000037,Running A Business Is My Cardio Printed T-Shirt,400,1799,1099,Shop Running A Business Is My Cardio Printed T-Shirt | Bargain.pk,running-a-business-is-my-cardio-printed-t-shirt,Running A Business Is My Cardio,funny,237
BFUN000038,So Much Internet To Do Printed T-Shirt,400,1799,1099,Shop So Much Internet To Do Printed T-Shirt | Bargain.pk,so-much-internet-to-do-printed-t-shirt,So Much Internet To Do,funny,237
BFUN000039,Im Having A Bad Day Printed T-Shirt,400,1799,1099,Shop Im Having A Bad Day Printed T-Shirt | Bargain.pk,im-having-a-bad-day-printed-t-shirt,Im Having A Bad Day,funny,237
BFUN000040,Warning You Cant Fix Stupid Printed T-Shirt,400,1799,1099,Shop Warning You Cant Fix Stupid Printed T-Shirt | Bargain.pk,warning-you-cant-fix-stupid-printed-t-shirt,Warning You Cant Fix Stupid,funny,237
BFUN000041,NOPE Printed T-Shirt,400,1799,1099,Shop NOPE Printed T-Shirt | Bargain.pk,nope-printed-t-shirt,N.O.P.E,funny,237
BFUN000042,The Boss Printed T-Shirt,400,1799,1099,Shop The Boss Printed T-Shirt | Bargain.pk,the-boss-printed-t-shirt,The Boss,funny,237
BFUN000043,Thanks For Nothing Printed T-Shirt,400,1799,1099,Shop Thanks For Nothing Printed T-Shirt | Bargain.pk,thanks-for-nothing-printed-t-shirt,Thanks For Nothing,funny,237
BFUN000044,Dont Be Rude Printed T-Shirt,400,1799,1099,Shop Dont Be Rude Printed T-Shirt | Bargain.pk,dont-be-rude-printed-t-shirt,Dont Be Rude,funny,237
BFUN000045,Me Over Reacting Probably Printed T-Shirt,400,1799,1099,Shop Me Over Reacting Probably Printed T-Shirt | Bargain.pk,me-over-reacting-probably-printed-t-shirt,Me Over Reacting Probably,funny,237
BFUN000046,My Brain Has Too Many Tabs Open Printed T-Shirt,400,1799,1099,Shop My Brain Has Too Many Tabs Open Printed T-Shirt | Bargain.pk,my-brain-has-too-many-tabs-open-printed-t-shirt,My Brain Has Too Many Tabs Open,funny,237
BFUN000047,How About No Printed T-Shirt,400,1799,1099,Shop How About No Printed T-Shirt | Bargain.pk,how-about-no-printed-t-shirt,How About No,funny,237
BFUN000048,I Hope Your Wifi Dies Printed T-Shirt,400,1799,1099,Shop I Hope Your Wifi Dies Printed T-Shirt | Bargain.pk,i-hope-your-wifi-dies-printed-t-shirt,I Hope Your Wifi Dies,funny,237
BFUN000049,Why Always Me Printed T-Shirt,400,1799,1099,Shop Why Always Me ?? Printed T-Shirt | Bargain.pk,why-always-me-printed-t-shirt,Why Always Me,funny,237
BFUN000050,Tea Shirt Printed T-Shirt,400,1799,1099,Shop Tea Shirt Printed T-Shirt | Bargain.pk,tea-shirt-printed-t-shirt,Tea Shirt,funny,237
BFUN000051,I Dont Stalk I Investigate Printed T-Shirt,400,1799,1099,Shop I Dont Stalk I Investigate Printed T-Shirt | Bargain.pk,i-dont-stalk-i-investigate-printed-t-shirt,I Dont Stalk I Investigate,funny,237
BFUN000052,Cutie But Psycho Printed T-Shirt,400,1799,1099,Shop Cutie But Psycho Printed T-Shirt | Bargain.pk,cutie-but-psycho-printed-t-shirt,Cutie But Psycho,funny,237
BFUN000053,Shhh No One Cares Printed T-Shirt,400,1799,1099,Shop Shhh No One Cares Printed T-Shirt | Bargain.pk,shhh-no-one-cares-printed-t-shirt,Shhh No One Cares,funny,237
BFUN000054,Allergic To Morning Printed T-Shirt,400,1799,1099,Shop Allergic To Morning Printed T-Shirt | Bargain.pk,allergic-to-morning-printed-t-shirt,Allergic To Morning,funny,237
BFUN000055,Patience Printed T-Shirt,400,1799,1099,Shop Patience Printed T-Shirt | Bargain.pk,patience-printed-t-shirt,Patience,funny,237
BFUN000056,How You Doin Printed T-Shirt,400,1799,1099,Shop How You Doin Printed T-Shirt | Bargain.pk,how-you-doin-printed-t-shirt,How You Doin,funny,237
BFUN000057,My Life Feels Like A Test I Dont Study For Printed T-Shirt,550,1999,1299,Shop My Life Feels Like A Test I Dont Study For Printed T-Shirt | Bargain.pk,my-life-feels-like-a-test-i-dont-study-for-printed-t-shirt,My Life Feels Like A Test I Dont Study For,funny,237
BFUN000058,Friends Dont Lie Printed T-Shirt,400,1799,1099,Shop Friends Dont Lie Printed T-Shirt | Bargain.pk,friends-dont-lie-printed-t-shirt,Friends Dont Lie,funny,237
BFUN000059,Mouth Operates Faster Than Brain Printed T-Shirt,550,1999,1299,Shop Mouth Operates Faster Than Brain Printed T-Shirt | Bargain.pk,mouth-operates-faster-than-brain-printed-t-shirt,Mouth Operates Faster Than Brain,funny,237
BFUN000060,Im Not Stubborn Im Just Always Right Printed T-Shirt,400,1799,1099,Shop Im Not Stubborn Im Just Always Right Printed T-Shirt | Bargain.pk,im-not-stubborn-im-just-always-right-printed-t-shirt,Im Not Stubborn Im Just Always Right,funny,237
BFUN000061,I Know Nothing Printed T-Shirt,400,1799,1099,Shop I Know Nothing Printed T-Shirt | Bargain.pk,i-know-nothing-printed-t-shirt,I Know Nothing,funny,237
BFUN000062,Messy Hair Dont Care Printed T-Shirt,400,1799,1099,Shop Messy Hair Dont Care Printed T-Shirt | Bargain.pk,messy-hair-dont-care-printed-t-shirt,Messy Hair Dont Care,funny,237
BFUN000063,Keep Your Dream Alive Printed T-Shirt,400,1799,1099,Shop Keep Your Dream Alive Printed T-Shirt | Bargain.pk,keep-your-dream-alive-printed-t-shirt,Keep Your Dream Alive Hit The Snnoze Button,funny,237
BFUN000064,Exercise I Thought You Said Printed T-Shirt,400,1799,1099,Shop Exercise I Thought You Said Printed T-Shirt | Bargain.pk,exercise-i-thought-you-said-printed-t-shirt,Exercise I Thought You Said Extra Fries,funny,237
BFUN000065,Naughty But Nice Printed T-Shirt,400,1799,1099,Shop Naughty But Nice Printed T-Shirt | Bargain.pk,naughty-but-nice-printed-t-shirt,Naughty But Nice,funny,237
BFUN000066,Friday Printed T-Shirt,400,1799,1099,Shop Friday Printed T-Shirt | Bargain.pk,friday-printed-t-shirt,Friday,funny,237
BFUN000067,Weekends Are For Waffles Printed T-Shirt,400,1799,1099,Shop Weekends Are For Waffles Printed T-Shirt | Bargain.pk,weekends-are-for-waffles-printed-t-shirt,Weekends Are For Waffles,funny,237
BFUN000068,The Original Printed T-Shirt,400,1799,1099,Shop The Original Printed T-Shirt | Bargain.pk,the-original-printed-t-shirt,The Original,funny,237
BFUN000069,Im Not In A Bad Mood Printed T-Shirt,550,1999,1299,Shop Im Not In A Bad Mood Printed T-Shirt | Bargain.pk,im-not-in-a-bad-mood-printed-t-shirt,Im Not In A Bad Mood Youre Just Stupid,funny,237
