BIND00001,Celebrate Indepence Day Printed T-Shirt,400,1799,1099,Shop Celebrate Indepence Day Printed T-Shirt | Bargain.pk,celebrate-indepence-day-printed-t-shirt,I can and i will,Independence Day,pakistan-day,270
BIND00002,14 August Printed Cotton T-Shrit,400,1799,1099,Shop 14 August Printed Cotton T-Shrit | Bargain.pk,14-august-printed-cotton-t-shrit,Quiting is not an option,14th August,pakistan-day,270
BIND00003,Independence Day 14 August Round Neck T-Shirt,400,1799,1099,Shop Independence Day 14 August Round Neck T-Shirt | Bargain.pk,independence-day-14-august-round-neck-t-shirt,Downloading muscles,14th August,pakistan-day,270
BIND00004,The Celebration of Our Freedom T-Shirt,400,1799,1099,Shop The Celebration of Our Freedom T-Shirt | Bargain.pk,the-celebration-of-our-freedom-t-shirt,Its called exercise you should try sometime,celebration of freedom,pakistan-day,270
BIND00005,Independence 14th August Day Printed T-shirt,400,1799,1099,Shop Independence 14th August Day Printed T-shirt | Bargain.pk,independence-14th-august-day-printed-t-shirt,Straight outta gym,14th August,pakistan-day,270
BIND00006,Happy Independence Day Cotton T-shirt,400,1799,1099,Shop Happy Independence Day Cotton T-shirt | Bargain.pk,happy-independence-day-cotton-t-shirt,If the bar aint bending youre pretending,Independence Day,pakistan-day,270
