BAIR00001,Follow Us Air Force - Cotton T-Shirt,400,1799,1099,Shop Follow Us Air Force Cotton T-Shirt Online | Bargain.pk,follow-us-air-force-t-shirt,Follow us 
BAIR00002,How High You Fly Air Force - 100% Cotton T-Shirt,400,1799,1099,Shop How High You Fly Air Force 100% Cotton T-Shirt | Bargain.pk,how-high-you-fly-air-force-t-shirt,How high you fly depends on strong are you
BAIR00003,A Symbol Pride For The Nation - Printed T-Shirt,400,1799,1099,Shop Symbol Pride Air Force Pure Online Cotton T-Shirts | Bargain.pk,a-symbol-pride-for-the-nation-t-shirt,A symbol pride for the nation
BAIR00004,Your Destination Is Beyound - Pure Cotton T-Shirt,550,1999,1299,Shop Your Destination is Beyound T-Shirt Online | Bargain.pk ,your-destination-is-beyound-t-shirt,your destination is beyound everyone else destination
BAIR00005,Bold & Fearless Air Force - Cotton T-Shirt,400,1799,1099,Shop Bold & Fearless Air Force 100% Cotton T-Shirt | Bargain.pk,bold-&-fearless-air-force-t-shirt,bold and fearless
BAIR00006,Peace Through Strength - Round Neck T-Shirt,400,1799,1099,Shop Peace Through Strength Round neck T-Shirt | Bargain.pk,peace-through-strength-t-shirt,peace through strength
BAIR00007,In God We Trust - Round Neck Printed T-Shirt,400,1799,1099,Shop In God We Trust Air Force T-Shirt | Bargain.pk,in-god-we-trust-t-shirt,in god we trust all others we monitor
